{
  "card_id": "II-016",
  "act": "II",
  "zone": "The Grid",
  "driver": "ali",
  "card_type": "convoy",
  "title": "The Arm Points Left",
  "hook": "Deac's arm is straight left. The volunteer is third.",
  "scene": "Rain at midday in the Kent Station lot again, different stalls, same wet deck. Deac has the Ledger pointed at the exit, amber sign dark. He needs a left onto 1st. His left arm comes out the driver window and holds, straight, fingers pointing left into the rain — not bent, not up. You are second. A volunteer is third. If you signal with lamps you light the deck. If you say nothing, the volunteer will read the gap on Deac's left as an opening and take the turn with him. Hands are the only signal that does not light the lot.",
  "decision": "Deac's left arm is straight out. How do you keep the volunteer off his left?",
  "options": [
    {
      "id": "a",
      "text": "Flash twice and pull left so the volunteer stays put",
      "correct": false,
      "result": "The flashes paint the deck. The volunteer reads it as go and comes around you into Deac's left. Three vehicles in an exit that holds two. Deac's arm is still out in a space that is no longer his.",
      "state_delta": {
        "light": 3,
        "noise": 2,
        "time_cost": 6
      }
    },
    {
      "id": "b",
      "text": "Left arm straight out to match, hold your place, and do not open a gap on his left",
      "correct": true,
      "result": "You put the same arm out the same window. You stay glued to his right-rear, not his left. The volunteer has no gap that is not a curb. Deac takes the left. You take it after him. The volunteer waits because the line was complete.",
      "state_delta": {
        "noise": -1,
        "time_cost": 4
      }
    },
    {
      "id": "c",
      "text": "Bend the arm up — that is the left-turn he meant",
      "correct": false,
      "result": "Your arm goes up. His stays flat. The volunteer copies you, not him, and starts a right that nobody called. Deac has to drop the turn. You taught the wrong sky to a man who was pointing at the street.",
      "state_delta": {
        "yaw": 1,
        "time_cost": 5
      }
    },
    {
      "id": "d",
      "text": "Horn once, short, so the volunteer freezes",
      "correct": false,
      "result": "The horn in a parking deck. Everyone freezes, including Deac. The Quiet using the far stairwell does not. You bought a second and spent the block.",
      "state_delta": {
        "noise": 5,
        "time_cost": 5
      }
    }
  ],
  "debrief": "A left turn is the left arm straight out the driver-side window, fingers pointing left. Match Deac on that side and stay off his left. You took the left after him, not beside him.",
  "source": {
    "psdp_skill": "Skill five: driving on a quiet street – part two",
    "dol_section": "4.14 Turning",
    "teaching_target": "Left turn: left arm out the driver window, straight, fingers pointing left; match convoy signals and do not leave a gap on the turning side."
  },
  "cast": [
    "ali",
    "deac"
  ],
  "antagonist": "load",
  "callback_of": null,
  "schedules_callback": false,
  "image_brief": {
    "camera": "POV_CHASE",
    "camera_is_the_lesson": true,
    "subject": "Deac's left arm extending from the window on the LEFT side of the frame, seen from directly behind the Ledger, arm straight out horizontally, fingers pointing level left",
    "foreground": "wet following-vehicle glass, rain, the Ledger's left rear quarter",
    "midground": "open window on the left side of the frame; the right side of the vehicle is closed and no arm appears there",
    "background": "Kent Station deck, midday rain, unlit lamps, a volunteer van cheating left of the line",
    "read": "the arm is straight out to the left — not bent up — extending from the window on the left side of the frame",
    "continuity": [
      "the_ledger",
      "pink_menace_exterior",
      "deac",
      "hand_signals"
    ],
    "aspect": "2:3",
    "geometry": {
      "ego_heading": "away_from_camera",
      "ego_lane_side": "right half of the roadway (US)",
      "ego_nose_in_frame": "the Ledger's nose points toward the top of the frame",
      "oncoming_position": "none in frame",
      "hazard_position": "none"
    }
  },
  "variation": {
    "location_type": "parking_lot",
    "weather": "rain",
    "time_of_day": "midday",
    "tone": "quiet",
    "failure_mode": "passengers"
  }
}
