{
  "card_id": "II-012",
  "act": "II",
  "zone": "The Grid",
  "driver": "ali",
  "card_type": "scene",
  "title": "Three Seconds, Not One",
  "hook": "You can see his hitch. You should be seeing pavement.",
  "scene": "A volunteer van is glued to a Kent school-zone exit at dusk, overcast, lamps already flashing for a shift that will not come. You are behind him. He is behind a dead sedan that is actually just parked badly. Your following gap is a bumper. The clipboard said space. The van's brake lamps are already dirty. If he dumps them, you will eat his trailer hitch with a plow that rings. The insulin is stable. Your right foot is not. You can see his tires. You should be able to see pavement.",
  "decision": "You can only see his hitch. How much road do you put back?",
  "options": [
    {
      "id": "a",
      "text": "Stay on him so nobody cuts in — this zone is too narrow for a real gap",
      "correct": false,
      "result": "He dumps the brakes for a cat. You dump yours for him. The plow kisses the hitch. Not a crash. A note. The school-zone lamps keep flashing over a sound that did not need to happen.",
      "state_delta": {
        "noise": 3,
        "damage": 1,
        "yaw": 1,
        "time_cost": 4
      }
    },
    {
      "id": "b",
      "text": "Leave at least twice your vehicle's length — lift until you can count three seconds off a mark, then hold that",
      "correct": true,
      "result": "You let him go. A faded crack in the asphalt passes his bumper; you count one-one-thousand, two, three, then take the throttle back. You can see his tires and the road under them. When he does dump it, you are already covering. No note. No kiss.",
      "state_delta": {
        "noise": -1,
        "time_cost": 3
      }
    },
    {
      "id": "c",
      "text": "Pass him in the zone so you are not the one eating the hitch",
      "correct": false,
      "result": "You pull out flashing. He drifts right from surprise. You make the pass and inherit the parked sedan as your new hitch. The lamps saw the whole thing. So did whatever uses this fence after dusk.",
      "state_delta": {
        "noise": 2,
        "light": 1,
        "time_cost": 3
      }
    },
    {
      "id": "d",
      "text": "Close up and flash him once to tell him to move",
      "correct": false,
      "result": "The flash fills his glass. He brakes from the insult. You are closer than when you started. He never had a place to go. You just asked a following-distance problem to become a light problem.",
      "state_delta": {
        "light": 3,
        "noise": 1,
        "time_cost": 5
      }
    }
  ],
  "debrief": "Leave a distance that's at least twice the length of your vehicle. Count it off a mark: three seconds on dry pavement, six in rain, fog, and snow. Rear-end crashes are the most common kind. Opening that gap is the best thing a new driver can do. A mark on the pavement, then one, two, three.",
  "source": {
    "psdp_skill": "Skill three: how close are you?",
    "dol_section": "5.2 Space",
    "teaching_target": "Guide 5.2: leave at least twice the length of your vehicle. Count three seconds off a mark to hold it on dry pavement; if you cannot see pavement under the vehicle ahead, you are too close.",
    "stat_cited": "PSDP p.11: Rear-end collisions are the most common form of a car crash; increasing following distance is the single best thing a new driver can do to reduce crash risk."
  },
  "cast": [
    "ali"
  ],
  "antagonist": "load",
  "callback_of": null,
  "schedules_callback": false,
  "image_brief": {
    "camera": "POV_COCKPIT",
    "subject": "the rear of a dark volunteer van filling the windshield mesh; a trailer hitch is bolted to the VAN'S rear bumper only, occupying the lower center of the glass; no pavement visible between the cars",
    "foreground": "worn black steering wheel and faded pink dash; the Menace hood is a thin pink bar at the very bottom of the glass with a flat plow blade — no hitch, no coupler, no ball mount on the hood",
    "midground": "the van's hitch on the van's bumper in lower center, dirty van doors filling the upper third, no gap of road",
    "background": "almost none — the van is the frame; a smear of flashing school-zone white at the extreme edges",
    "read": "the hitch occupies the lower center of the glass and there is no road between you and it",
    "continuity": [
      "pink_menace_interior"
    ],
    "aspect": "2:3",
    "geometry": {
      "ego_heading": "away_from_camera",
      "ego_lane_side": "right half of the roadway (US)",
      "ego_nose_in_frame": "the plow blade is a pink bar at the bottom of the glass, pointing toward the hitch",
      "oncoming_position": "none in frame",
      "hazard_position": "ahead_same_direction"
    }
  },
  "variation": {
    "location_type": "school_zone",
    "weather": "overcast",
    "time_of_day": "dusk",
    "tone": "urgent",
    "failure_mode": "passengers"
  }
}
