{
  "card_id": "II-023",
  "act": "II",
  "zone": "The Grid",
  "driver": "ali",
  "card_type": "rule",
  "title": "Do Not Block the Mill",
  "hook": "A pickup is dead in the only live lane.",
  "scene": "Rain on a Kent mill-and-fill in the afternoon, one lane open, the other a trench. A pickup is already stopped in the open lane with its hood up, two people standing in the travel path like the mill is a driveway. There is no shoulder that is not a drop. Your instinct is to queue behind them and wait, which makes you the third body in a lane that still has a through. The sign at the start of the zone said DO NOT STOP. It meant it. You need a hole that is not their repair.",
  "decision": "They are stopped in the only live lane. Where do you put the Menace?",
  "options": [
    {
      "id": "a",
      "text": "Queue behind them with hazards on so the next car sees a line",
      "correct": false,
      "result": "Hazards in a trench. The next car does see you. So does everything that hunts lamps. You are now a parked convoy in a work zone that forbade stopping. The pickup never asked you to join the repair.",
      "state_delta": {
        "light": 4,
        "time_cost": 10
      }
    },
    {
      "id": "b",
      "text": "Squeeze past them in the trench because you cannot stop",
      "correct": false,
      "result": "The knobbies drop off the mill. You high-center on the lip. Now there are two dead vehicles in a one-lane zone. The rain does the rest of the talking.",
      "state_delta": {
        "damage": 3,
        "noise": 3,
        "yaw": 2,
        "time_cost": 20
      }
    },
    {
      "id": "c",
      "text": "Stop short of their scene, then wait in their lane until they move",
      "correct": false,
      "result": "You are polite and you are a blockage. A volunteer comes the other way in a lane that was supposed to be yours. Four people, one trench, no grammar.",
      "state_delta": {
        "time_cost": 12,
        "noise": 1
      }
    },
    {
      "id": "d",
      "text": "Do not stop in the zone: take the first legal turnout before the mill, then a different street",
      "correct": true,
      "result": "You refuse the queue. A driveway before the cones is a driveway. You reverse into it, wait for a hole that is not their hood, and take the next street south. The mill keeps being a mill. You keep being traffic instead of a second accident.",
      "state_delta": {
        "noise": -1,
        "time_cost": 8
      }
    }
  ],
  "debrief": "Do not stop in a live work lane to rubberneck or to join someone else's breakdown. If the lane is blocked, leave the zone at the first legal turnout and reroute. Hazards in a trench are a beacon. Your job is to remain a moving vehicle.",
  "source": {
    "psdp_skill": "Skill six: looking ahead",
    "dol_section": "4.17 Zones (Work zone)",
    "teaching_target": "Never stop or park in a live work-zone travel lane; leave the zone and reroute if the lane is blocked."
  },
  "cast": [
    "ali"
  ],
  "antagonist": "none",
  "callback_of": null,
  "schedules_callback": false,
  "image_brief": {
    "camera": "POV_COCKPIT",
    "subject": "a pickup stopped in the only milled live lane, hood up, two people standing in the travel path, rain on the mesh",
    "foreground": "worn wheel and wipers mid-sweep",
    "midground": "cone line, trench on the right, no shoulder",
    "background": "Kent afternoon rain, a DO NOT STOP sign already behind you, gray nothing ahead",
    "read": "the only lane is already occupied by a stopped repair — joining it is the error",
    "continuity": [
      "pink_menace_interior"
    ],
    "aspect": "2:3",
    "geometry": {
      "ego_heading": "away_from_camera",
      "ego_lane_side": "right half of the roadway (US)",
      "ego_nose_in_frame": "the plow blade points toward the top of the frame",
      "oncoming_position": "none in frame",
      "hazard_position": "ahead_same_direction"
    }
  },
  "variation": {
    "location_type": "work_zone",
    "weather": "rain",
    "time_of_day": "afternoon",
    "tone": "quiet",
    "failure_mode": "none"
  }
}
