{
  "card_id": "II-007",
  "act": "II",
  "zone": "The Grid",
  "driver": "ali",
  "card_type": "scene",
  "title": "Bus 12, Amber",
  "hook": "Bus 12's ambers just came on. The left lane is open.",
  "scene": "Fourth Ave South, Kent, and the rain has been going since Renton. Half a block up, Bus 12 rolls at maybe fifteen. Reyna runs the last shelter route and she runs it on time. The amber lamps come on above her rear window. Gracie stands up in the passenger footwell. You are carrying insulin that has a hundred and ten minutes of cold left, and there is a clear lane to Reyna's left.",
  "decision": "The amber lamps are on and the left lane is open. What do you do?",
  "options": [
    {
      "id": "a",
      "text": "Take the left lane and get past her before the reds come on",
      "correct": false,
      "result": "You are alongside the front bumper when the reds fire and the stop arm swings into your door line. The plow catches it. Steel on steel, and the sound goes out across four blocks of flat wet street. Reyna does not blow the horn. She does not have to.",
      "state_delta": {
        "noise": 4,
        "damage": 1,
        "yaw": 1,
        "time_cost": 6
      }
    },
    {
      "id": "b",
      "text": "Ease off and start slowing now, staying behind her",
      "correct": true,
      "result": "You lift and let the gap open to four car lengths. The reds come on, the arm swings out, and a kid in a yellow shell comes around the front of the bus at a dead sprint without looking once. He is across before you have finished counting him. Reyna gives you two fingers off the wheel.",
      "state_delta": {
        "noise": -1,
        "time_cost": 4
      }
    },
    {
      "id": "c",
      "text": "Hold your speed and stay behind — you'll stop when the reds come on",
      "correct": false,
      "result": "You are still at twenty-eight when the reds fire. Hard on the brakes, wet asphalt, and the Menace squats and squeals to a stop with the plow eight feet off her bumper. You stopped legally. You also just rang a bell on a quiet street, and something moves at the treeline four blocks down.",
      "state_delta": {
        "noise": 3,
        "yaw": 2,
        "time_cost": 3
      }
    },
    {
      "id": "d",
      "text": "Flash your headlights so Reyna knows you're behind her",
      "correct": false,
      "result": "The flash bounces off the wet street and every window on the block. Reyna's hand comes out the window, flat, palm down — cut it. The reds fire anyway, and you brake late because you were watching her hand instead of her lamps.",
      "state_delta": {
        "light": 4,
        "noise": 1,
        "time_cost": 5
      }
    }
  ],
  "debrief": "Amber lamps mean the bus is preparing to stop. That is your cue to slow, not a last chance to pass. Red lamps plus the stop arm mean a full stop from both directions until the arm comes back in. Wait behind her until the arm folds.",
  "source": {
    "psdp_skill": "Skill six: looking ahead",
    "dol_section": "4.2 Sharing with school buses",
    "teaching_target": "Amber lamps signal an approaching stop; red lamps and extended stop arm require a full stop from both directions."
  },
  "cast": [
    "ali",
    "gracie",
    "reyna_solis",
    "bus_12",
    "tobin"
  ],
  "antagonist": "none",
  "callback_of": null,
  "schedules_callback": true,
  "image_brief": {
    "camera": "POV_COCKPIT",
    "subject": "the rear of Bus 12 half a block ahead, amber lamps lit above the rear window",
    "foreground": "the worn black leather steering wheel rim across the bottom of frame and welded steel mesh across the top of the windshield",
    "midground": "wet two-lane residential street, an open and empty left lane, water beading and running on the glass",
    "background": "flat gray overcast, bare maples, single-story Kent houses receding, wipers mid-sweep",
    "read": "the two amber lamps are lit and the red lamps directly beside them are dark — the distinction must be unmistakable at a glance",
    "continuity": [
      "pink_menace_interior",
      "bus_12"
    ],
    "aspect": "2:3",
    "geometry": {
      "ego_heading": "away_from_camera",
      "ego_lane_side": "right half of the roadway (US)",
      "ego_nose_in_frame": "the plow blade points toward the top of the frame",
      "oncoming_position": "none in frame",
      "hazard_position": "ahead_same_direction"
    }
  },
  "variation": {
    "location_type": "residential",
    "weather": "rain",
    "time_of_day": "afternoon",
    "tone": "tense",
    "failure_mode": "speed"
  }
}
